{
  "claim_boundary": "Label-blind semantic descriptor harvest only; not a structural-signal, training-efficiency, inference-efficiency, break-even, independent-review or peer-review result.",
  "contract_sha256": "fe4bec2cdf1d48f7c90b310288eadd1955edade940de1b9ddb82973b7dd53777",
  "created_at_utc": "2026-08-11T14:07:54Z",
  "descriptor_receipt_sha256": "5b33d0e858121b991ea5c2233af903a78342652f9cba048760ce9289a55fba1a",
  "descriptor_record_count": 16,
  "descriptor_status": "READY",
  "execution_receipt_sha256": "b9a6f42b124455d62965bffa13b32722638c1c100a705afa55f755833780ca94",
  "expected_repo_sha": "0c5384e84ac62ab0fe14a7f728a0f68ffd3f2186",
  "failures": [],
  "frozen_parent_sha": "f86fb72eee1331fe083ce6de86bafe7fd727764f",
  "label_chronology_receipt_sha256": "cfa7d9b1473bc99f6db192b6a67a28d1527b9e03594563854dc41623cbddd50e",
  "label_chronology_state": "ZERO_LABELS_OBSERVED",
  "parent_stage_harvest_sha256": "4707f64a5a32768bee0f50051e06d8b6730db98ec0f22aa8528ecf9530185f41",
  "parent_stage_job_id": "3476291",
  "phase": "DESCRIPTOR",
  "schema_version": "paper3-semantic-lunarc-harvest-v1",
  "slurm_account": "lu2026-2-51",
  "slurm_elapsed_seconds": 36,
  "slurm_exit_code": 0,
  "slurm_exit_status": [
    "SUCCESS"
  ],
  "slurm_job_id": "3476296",
  "slurm_partition": "lu48",
  "slurm_state": [
    "COMPLETED"
  ],
  "stage_runtime_tree_sha256": "8c0631333fa3bcaa71d0e5a0408183de4e0c8af145dfd9ccb5f3406386efdc73",
  "submission_receipt_sha256": "83127767ac9724bb5da50e6285d5a75c652c9b5f47288be4321f7b5a53a60b06",
  "training_authorized": false,
  "verdict": "HARVEST_DESCRIPTOR_READY"
}
