{
  "claim_boundary": "Label-blind semantic descriptor harvest only; not a structural-signal, training-efficiency, inference-efficiency, break-even, independent-review or peer-review result.",
  "contract_sha256": "fe4bec2cdf1d48f7c90b310288eadd1955edade940de1b9ddb82973b7dd53777",
  "created_at_utc": "2026-08-11T17:50:21Z",
  "descriptor_receipt_sha256": "b3397e5fa5a39dd00cb59e9a47cff4f7e7fec50c1e506930bc517bc87e556b45",
  "descriptor_record_count": 16,
  "descriptor_status": "READY",
  "execution_receipt_sha256": "55c6380f8cecc36944c9fa4ba567c65e413769a16d894ed59bf9802d66f5d7fd",
  "expected_repo_sha": "787c7e00af2a5877ccb715bc807ec14f52974e9c",
  "failures": [],
  "frozen_parent_sha": "f86fb72eee1331fe083ce6de86bafe7fd727764f",
  "label_chronology_receipt_sha256": "6009e2310ba1bb0f3b94c8cf1a9c8f984e020cd07cc392719a50c504433ff4ab",
  "label_chronology_state": "ZERO_LABELS_OBSERVED",
  "parent_stage_harvest_sha256": "e149a376222f0168234d1bdb0e193d7b25aa42d5ebf463bd4e1682011e3a9792",
  "parent_stage_job_id": "3476519",
  "phase": "DESCRIPTOR",
  "schema_version": "paper3-semantic-lunarc-harvest-v1",
  "slurm_account": "lu2026-2-51",
  "slurm_elapsed_seconds": 48,
  "slurm_exit_code": 0,
  "slurm_exit_status": [
    "SUCCESS"
  ],
  "slurm_job_id": "3476527",
  "slurm_partition": "lu48",
  "slurm_state": [
    "COMPLETED"
  ],
  "stage_runtime_tree_sha256": "8c0631333fa3bcaa71d0e5a0408183de4e0c8af145dfd9ccb5f3406386efdc73",
  "submission_receipt_sha256": "115a5b9e9d61ada1646be8ce80b869a75aa13194e3af64da11006d3b0ac2a0dd",
  "training_authorized": false,
  "verdict": "HARVEST_DESCRIPTOR_READY"
}
